{"workspace_version":"1.0","workspace_id":"workspace-1","canonical_root":"/trusted/workspace-1","task_ref":"aaaaaaaaaaaaaaaaaaaaaaaaaaaaaaaaaaaaaaaaaaaaaaaaaaaaaaaaaaaaaaaa","snapshot_digest":"aaaaaaaaaaaaaaaaaaaaaaaaaaaaaaaaaaaaaaaaaaaaaaaaaaaaaaaaaaaaaaaa","ownership":"harness_owned","lifecycle":"ephemeral_prepared","provenance":{"manager_version":"1.0","kind":"trusted_workspace_manager"}}
